{
	"$schema": "config.schema.json",
	"markets": [
		"US"
	],
	"language": "en-us",
	"platformsToFetch": [
		"console",
		"pc",
		"eaPlay"
	],
	"outputFormat": "array",
	"treatEmptyStringsAsNull": true,
	"keepCompleteProperties": false,
	"outputDirectory": "output",
	"includedProperties": {
		"productTitle": true,
		"productId": false,
		"developerName": false,
		"publisherName": false,
		"categories": false,
		"productDescription": {
			"enabled": false,
			"preferShort": false
		},
		"images": {
			"enabled": false,
			"imageTypes": {
				"TitledHeroArt": -1,
				"SuperHeroArt": -1,
				"Logo": -1,
				"Poster": -1,
				"Screenshot": -1,
				"BoxArt": -1,
				"Hero": -1,
				"BrandedKeyArt": -1,
				"FeaturePromotionalSquareArt": -1
			}
		},
		"releaseDate": {
			"enabled": false,
			"format": "date"
		},
		"userRating": {
			"enabled": false,
			"aggregationInterval": "AllTime",
			"format": "percentage"
		},
		"pricing": {
			"enabled": false,
			"priceTypes": [
				"ListPrice",
				"MSRP",
				"WholesalePrice"
			],
			"missingPricePolicy": "useNull"
		},
		"storePage": false
	}
}